{
  "$schema": "../../schemas/source-to-clause-crosswalk.schema.json",
  "schema_version": "1.0.0",
  "crosswalk_id": "ghre-rla-2026-07-14-source-to-clause",
  "source_manifest_ref": "source-manifest.json",
  "source_outline_count": 161,
  "entries": [
    {
      "source_ref": "document-title",
      "source_heading": "RESIDENTIAL LEASE AGREEMENT",
      "source_order": 1,
      "source_level": "Title",
      "source_page": 1,
      "target_kind": "template_title",
      "target_ref": "residential-lease-title",
      "target_style": "Title",
      "coverage_status": "mapped",
      "gate_id": null
    },
    {
      "source_ref": "table-of-contents",
      "source_heading": "Table of Contents",
      "source_order": 2,
      "source_level": "Heading 1",
      "source_page": 2,
      "target_kind": "template_toc",
      "target_ref": "dynamic-table-of-contents",
      "target_style": "Heading 1",
      "coverage_status": "mapped",
      "gate_id": null
    },
    {
      "source_ref": "article-1",
      "source_heading": "1. Parties, Premises, Occupancy, and Required Disclosures",
      "source_order": 3,
      "source_level": "Heading 1",
      "source_page": 3,
      "target_kind": "template_article_heading",
      "target_ref": "article-1",
      "target_style": "Heading 1",
      "coverage_status": "mapped",
      "gate_id": null
    },
    {
      "source_ref": "1.1",
      "source_heading": "1.1. Parties",
      "source_order": 4,
      "source_level": "Heading 2",
      "source_page": 3,
      "target_kind": "clause",
      "target_ref": "RLA-010",
      "target_style": "Heading 2",
      "coverage_status": "mapped",
      "gate_id": null
    },
    {
      "source_ref": "1.2",
      "source_heading": "1.2. Premises",
      "source_order": 5,
      "source_level": "Heading 2",
      "source_page": 3,
      "target_kind": "clause",
      "target_ref": "RLA-010",
      "target_style": "Heading 3",
      "coverage_status": "mapped",
      "gate_id": null
    },
    {
      "source_ref": "1.3",
      "source_heading": "1.3. Lease Summary",
      "source_order": 6,
      "source_level": "Heading 2",
      "source_page": 3,
      "target_kind": "template_component",
      "target_ref": "lease-summary-table",
      "target_style": "Heading 2",
      "coverage_status": "mapped",
      "gate_id": null
    },
    {
      "source_ref": "1.4",
      "source_heading": "1.4. Landlord Disclosure and Notice Address",
      "source_order": 7,
      "source_level": "Heading 2",
      "source_page": 3,
      "target_kind": "template_component",
      "target_ref": "landlord-disclosure-and-notice-address",
      "target_style": "Heading 2",
      "coverage_status": "mapped",
      "gate_id": null
    },
    {
      "source_ref": "1.5",
      "source_heading": "1.5. Approved Occupants",
      "source_order": 8,
      "source_level": "Heading 2",
      "source_page": 4,
      "target_kind": "clause",
      "target_ref": "RLA-020",
      "target_style": "Heading 2",
      "coverage_status": "mapped",
      "gate_id": null
    },
    {
      "source_ref": "1.6",
      "source_heading": "1.6. Joint and Several Responsibility",
      "source_order": 9,
      "source_level": "Heading 2",
      "source_page": 4,
      "target_kind": "clause",
      "target_ref": "RLA-020",
      "target_style": "Heading 3",
      "coverage_status": "mapped",
      "gate_id": null
    },
    {
      "source_ref": "1.7",
      "source_heading": "1.7. Application Accuracy and Contact Information",
      "source_order": 10,
      "source_level": "Heading 2",
      "source_page": 4,
      "target_kind": "clause",
      "target_ref": "RLA-020",
      "target_style": "Heading 3",
      "coverage_status": "mapped",
      "gate_id": null
    },
    {
      "source_ref": "1.8",
      "source_heading": "1.8. Fair Housing and Accommodation Requests",
      "source_order": 11,
      "source_level": "Heading 2",
      "source_page": 4,
      "target_kind": "clause",
      "target_ref": "RLA-030",
      "target_style": "Heading 2",
      "coverage_status": "mapped",
      "gate_id": null
    },
    {
      "source_ref": "article-2",
      "source_heading": "2. Term, Possession, Renewal, Early Termination, and Holdover",
      "source_order": 12,
      "source_level": "Heading 1",
      "source_page": 4,
      "target_kind": "template_article_heading",
      "target_ref": "article-2",
      "target_style": "Heading 1",
      "coverage_status": "mapped",
      "gate_id": null
    },
    {
      "source_ref": "2.1",
      "source_heading": "2.1. Lease Term",
      "source_order": 13,
      "source_level": "Heading 2",
      "source_page": 4,
      "target_kind": "clause",
      "target_ref": "RLA-040",
      "target_style": "Heading 2",
      "coverage_status": "mapped",
      "gate_id": null
    },
    {
      "source_ref": "2.2",
      "source_heading": "2.2. Move-In and Possession",
      "source_order": 14,
      "source_level": "Heading 2",
      "source_page": 4,
      "target_kind": "clause",
      "target_ref": "RLA-040",
      "target_style": "Heading 3",
      "coverage_status": "mapped",
      "gate_id": null
    },
    {
      "source_ref": "2.3",
      "source_heading": "2.3. Delay of Possession",
      "source_order": 15,
      "source_level": "Heading 2",
      "source_page": 4,
      "target_kind": "clause",
      "target_ref": "RLA-040",
      "target_style": "Heading 3",
      "coverage_status": "mapped",
      "gate_id": null
    },
    {
      "source_ref": "2.4",
      "source_heading": "2.4. End of Fixed Term and Month-to-Month Conversion",
      "source_order": 16,
      "source_level": "Heading 2",
      "source_page": 4,
      "target_kind": "clause",
      "target_ref": "RLA-050",
      "target_style": "Heading 2",
      "coverage_status": "mapped",
      "gate_id": null
    },
    {
      "source_ref": "2.5",
      "source_heading": "2.5. Notice of Move-Out at End of Fixed Term",
      "source_order": 17,
      "source_level": "Heading 2",
      "source_page": 4,
      "target_kind": "clause",
      "target_ref": "RLA-050",
      "target_style": "Heading 3",
      "coverage_status": "mapped",
      "gate_id": null
    },
    {
      "source_ref": "2.6",
      "source_heading": "2.6. Month-to-Month Termination",
      "source_order": 18,
      "source_level": "Heading 2",
      "source_page": 5,
      "target_kind": "clause",
      "target_ref": "RLA-050",
      "target_style": "Heading 3",
      "coverage_status": "mapped",
      "gate_id": null
    },
    {
      "source_ref": "2.7",
      "source_heading": "2.7. Rent Increases and Renewal Terms",
      "source_order": 19,
      "source_level": "Heading 2",
      "source_page": 5,
      "target_kind": "clause",
      "target_ref": "RLA-050",
      "target_style": "Heading 3",
      "coverage_status": "mapped",
      "gate_id": null
    },
    {
      "source_ref": "2.8",
      "source_heading": "2.8. Tenant Early Termination / Buy-Out",
      "source_order": 20,
      "source_level": "Heading 2",
      "source_page": 5,
      "target_kind": "clause",
      "target_ref": "RLA-060",
      "target_style": "Heading 2",
      "coverage_status": "mapped",
      "gate_id": null
    },
    {
      "source_ref": "2.9",
      "source_heading": "2.9. Unauthorized Early Move-Out",
      "source_order": 21,
      "source_level": "Heading 2",
      "source_page": 5,
      "target_kind": "clause",
      "target_ref": "RLA-060",
      "target_style": "Heading 3",
      "coverage_status": "mapped",
      "gate_id": null
    },
    {
      "source_ref": "2.10",
      "source_heading": "2.10. Job Relocation and Personal Circumstances",
      "source_order": 22,
      "source_level": "Heading 2",
      "source_page": 5,
      "target_kind": "clause",
      "target_ref": "RLA-060",
      "target_style": "Heading 3",
      "coverage_status": "mapped",
      "gate_id": null
    },
    {
      "source_ref": "2.11",
      "source_heading": "2.11. Military and Protected-Person Rights",
      "source_order": 23,
      "source_level": "Heading 2",
      "source_page": 5,
      "target_kind": "clause",
      "target_ref": "RLA-070",
      "target_style": "Heading 2",
      "coverage_status": "mapped",
      "gate_id": null
    },
    {
      "source_ref": "2.12",
      "source_heading": "2.12. Death of Sole Tenant",
      "source_order": 24,
      "source_level": "Heading 2",
      "source_page": 5,
      "target_kind": "clause",
      "target_ref": "RLA-070",
      "target_style": "Heading 3",
      "coverage_status": "mapped",
      "gate_id": null
    },
    {
      "source_ref": "2.13",
      "source_heading": "2.13. Holdover",
      "source_order": 25,
      "source_level": "Heading 2",
      "source_page": 5,
      "target_kind": "clause",
      "target_ref": "RLA-080",
      "target_style": "Heading 2",
      "coverage_status": "mapped",
      "gate_id": null
    },
    {
      "source_ref": "article-3",
      "source_heading": "3. Rent, Charges, and Payments",
      "source_order": 26,
      "source_level": "Heading 1",
      "source_page": 6,
      "target_kind": "template_article_heading",
      "target_ref": "article-3",
      "target_style": "Heading 1",
      "coverage_status": "mapped",
      "gate_id": null
    },
    {
      "source_ref": "3.1",
      "source_heading": "3.1. Base Rent",
      "source_order": 27,
      "source_level": "Heading 2",
      "source_page": 6,
      "target_kind": "clause",
      "target_ref": "RLA-090",
      "target_style": "Heading 2",
      "coverage_status": "mapped",
      "gate_id": null
    },
    {
      "source_ref": "3.2",
      "source_heading": "3.2. Initial Amounts Due Before Occupancy",
      "source_order": 28,
      "source_level": "Heading 2",
      "source_page": 6,
      "target_kind": "template_component",
      "target_ref": "initial-amounts-due-table",
      "target_style": "Heading 2",
      "coverage_status": "mapped",
      "gate_id": null
    },